{
  "api_version": "1",
  "operation": "ukma.memory.evaluate_eviction.v1",
  "context": {
    "request_id": "x",
    "trace_id": "x",
    "scope": {
      "tenant_id": "x",
      "project_id": "x"
    },
    "principal_id": "x",
    "scopes": [],
    "consistency": "eventual"
  },
  "input": {
    "agent_id": "x",
    "dry_run": true,
    "policy_id": "x",
    "required_tokens": 0,
    "session_id": "x"
  }
}
